{
  "patient_id": "P-1002",
  "metadata": {
    "full_name": "Fatma Kaya",
    "age": 79,
    "gender": "female",
    "diagnosis": "Moderate Stage Dementia",
    "disease_stage": "moderate",
    "former_profession": "Tailor",
    "living_status": "Lives with her son and receives family caregiver support",
    "primary_caregiver": "Mehmet Kaya"
  },
  "orientation_support": {
    "current_home": "Üsküdar, Istanbul",
    "safe_place_reminder": "You are at home with your family.",
    "reassurance_message": "Fatma Hanım, evdesiniz. Oğlunuz Mehmet sizinle ilgileniyor ve güvendesiniz.",
    "emergency_contact_name": "Mehmet Kaya",
    "emergency_contact_relation": "Son"
  },
  "daily_routines": [
    {
      "time": "09:00",
      "activity": "Breakfast",
      "description": "Has breakfast with her son Mehmet.",
      "reminder_type": "meal"
    },
    {
      "time": "11:00",
      "activity": "Handcraft activity",
      "description": "Spends time with simple sewing or fabric-related activities.",
      "reminder_type": "activity"
    },
    {
      "time": "13:30",
      "activity": "Lunch and rest",
      "description": "Has lunch and rests afterwards.",
      "reminder_type": "meal"
    },
    {
      "time": "17:00",
      "activity": "Family photo time",
      "description": "Looks at family photos with her caregiver.",
      "reminder_type": "activity"
    },
    {
      "time": "20:30",
      "activity": "Evening medication",
      "description": "Takes evening medication with water after dinner.",
      "reminder_type": "medication"
    }
  ],
  "medications": [
    {
      "name": "Evening medication",
      "time": "20:30",
      "dose": "1 tablet",
      "note": "Taken with water after dinner."
    }
  ],
  "core_memories": [
    {
      "memory_id": "M-1002-FAMILY-01",
      "category": "family",
      "content": "Her son is named Mehmet. He lives with her and helps her during the day.",
      "keywords": ["son", "Mehmet", "family", "caregiver"],
      "emotional_tone": "calming"
    },
    {
      "memory_id": "M-1002-FAMILY-02",
      "category": "family",
      "content": "Her daughter-in-law is named Elif. Elif often prepares tea for her in the afternoon.",
      "keywords": ["daughter-in-law", "Elif", "tea", "family"],
      "emotional_tone": "positive"
    },
    {
      "memory_id": "M-1002-WORK-01",
      "category": "work",
      "content": "She worked as a tailor and enjoyed sewing dresses for her neighbors.",
      "keywords": ["tailor", "sewing", "dress", "work"],
      "emotional_tone": "positive"
    },
    {
      "memory_id": "M-1002-HOBBY-01",
      "category": "hobby",
      "content": "She likes touching colorful fabrics and talking about sewing patterns.",
      "keywords": ["fabric", "sewing patterns", "colors", "hobby"],
      "emotional_tone": "positive"
    },
    {
      "memory_id": "M-1002-PLACE-01",
      "category": "place",
      "content": "She lives in Üsküdar, Istanbul, with her son Mehmet.",
      "keywords": ["home", "Üsküdar", "Istanbul", "Mehmet"],
      "emotional_tone": "calming"
    },
    {
      "memory_id": "M-1002-VISUAL-01",
      "category": "visual_memory",
      "content": "Family photos help her remember Mehmet, Elif and her old sewing shop.",
      "keywords": ["family photos", "Mehmet", "Elif", "sewing shop"],
      "emotional_tone": "calming"
    }
  ],
  "family_members": [
    {
      "name": "Mehmet Kaya",
      "relation": "Son",
      "description": "Primary caregiver who lives with her and supports her daily needs."
    },
    {
      "name": "Elif Kaya",
      "relation": "Daughter-in-law",
      "description": "Often spends time with her at home and prepares afternoon tea."
    }
  ],
  "communication_preferences": {
    "preferred_language": "Turkish",
    "tone": "Warm, slow and reassuring",
    "answer_length": "short",
    "avoid": [
      "complex choices",
      "medical advice",
      "contradicting the patient harshly",
      "long explanations"
    ]
  },
  "sample_questions": [
    {
      "question": "Oğlum nerede?",
      "expected_answer_type": "family_recall",
      "expected_context_keywords": ["Mehmet", "son", "home"]
    },
    {
      "question": "Ben ne iş yapardım?",
      "expected_answer_type": "memory_recall",
      "expected_context_keywords": ["tailor", "sewing", "dress"]
    },
    {
      "question": "Burası neresi?",
      "expected_answer_type": "orientation",
      "expected_context_keywords": ["home", "Üsküdar", "safe"]
    },
    {
      "question": "Akşam ilacım var mı?",
      "expected_answer_type": "medication_reminder",
      "expected_context_keywords": ["evening medication", "20:30"]
    },
    {
      "question": "Bu fotoğraftakiler kim olabilir?",
      "expected_answer_type": "memory_recall",
      "expected_context_keywords": ["family photos", "Mehmet", "Elif"]
    }
  ],
  "safety_notes": {
    "medical_advice_policy": "The assistant must not provide diagnosis, treatment changes or medication dosage decisions.",
    "hallucination_policy": "The assistant must only use the information available in this synthetic persona context.",
    "emergency_policy": "If the user expresses danger, severe confusion or urgent medical symptoms, the assistant should recommend contacting the caregiver or emergency services."
  }
}