{
  "patient_id": "P-1003",
  "metadata": {
    "full_name": "Mehmet Demir",
    "age": 82,
    "gender": "male",
    "diagnosis": "Moderate Stage Alzheimer",
    "disease_stage": "moderate",
    "former_profession": "Retired Pharmacist",
    "living_status": "Lives with his wife and receives caregiver support from his nephew",
    "primary_caregiver": "Can Demir"
  },
  "orientation_support": {
    "current_home": "Bakırköy, Istanbul",
    "safe_place_reminder": "You are at home with your wife and your family is helping you.",
    "reassurance_message": "Mehmet Bey, evdesiniz ve güvendesiniz. Eşiniz Ayla Hanım evde, yeğeniniz Can da size yardımcı oluyor.",
    "emergency_contact_name": "Can Demir",
    "emergency_contact_relation": "Nephew"
  },
  "daily_routines": [
    {
      "time": "08:00",
      "activity": "Blood pressure check",
      "description": "Checks blood pressure with caregiver support before breakfast.",
      "reminder_type": "personal_care"
    },
    {
      "time": "08:30",
      "activity": "Breakfast",
      "description": "Has breakfast with his wife Ayla.",
      "reminder_type": "meal"
    },
    {
      "time": "09:00",
      "activity": "Morning medication",
      "description": "Takes morning medication after breakfast.",
      "reminder_type": "medication"
    },
    {
      "time": "13:00",
      "activity": "Lunch",
      "description": "Has lunch at home.",
      "reminder_type": "meal"
    },
    {
      "time": "15:00",
      "activity": "Short rest",
      "description": "Takes a short afternoon rest in the living room.",
      "reminder_type": "activity"
    },
    {
      "time": "19:00",
      "activity": "Dinner",
      "description": "Has dinner with his wife.",
      "reminder_type": "meal"
    },
    {
      "time": "21:30",
      "activity": "Night medication",
      "description": "Takes night medication before sleep.",
      "reminder_type": "medication"
    }
  ],
  "medications": [
    {
      "name": "Morning medication",
      "time": "09:00",
      "dose": "1 tablet",
      "note": "Taken after breakfast with water."
    },
    {
      "name": "Night medication",
      "time": "21:30",
      "dose": "1 tablet",
      "note": "Taken before sleep with caregiver confirmation."
    }
  ],
  "core_memories": [
    {
      "memory_id": "M-1003-FAMILY-01",
      "category": "family",
      "content": "His wife is named Ayla. They have been married for many years and she spends most of the day with him.",
      "keywords": ["wife", "Ayla", "marriage", "family"],
      "emotional_tone": "calming"
    },
    {
      "memory_id": "M-1003-FAMILY-02",
      "category": "family",
      "content": "His nephew Can helps him with appointments, medication reminders and daily organization.",
      "keywords": ["nephew", "Can", "caregiver", "appointments", "medication"],
      "emotional_tone": "calming"
    },
    {
      "memory_id": "M-1003-WORK-01",
      "category": "work",
      "content": "He worked as a pharmacist for many years and owned a small pharmacy in Bakırköy.",
      "keywords": ["pharmacist", "pharmacy", "Bakırköy", "work"],
      "emotional_tone": "positive"
    },
    {
      "memory_id": "M-1003-ROUTINE-01",
      "category": "routine",
      "content": "He is used to checking his blood pressure in the morning before breakfast.",
      "keywords": ["blood pressure", "morning", "breakfast", "routine"],
      "emotional_tone": "neutral"
    },
    {
      "memory_id": "M-1003-HOBBY-01",
      "category": "hobby",
      "content": "He enjoys listening to classical Turkish music in the afternoon.",
      "keywords": ["classical Turkish music", "afternoon", "music", "hobby"],
      "emotional_tone": "positive"
    },
    {
      "memory_id": "M-1003-PLACE-01",
      "category": "place",
      "content": "He lives in Bakırköy, Istanbul, in the apartment where he has lived with Ayla for many years.",
      "keywords": ["home", "Bakırköy", "Istanbul", "Ayla"],
      "emotional_tone": "calming"
    }
  ],
  "family_members": [
    {
      "name": "Ayla Demir",
      "relation": "Wife",
      "description": "His wife, who lives with him and provides emotional support."
    },
    {
      "name": "Can Demir",
      "relation": "Nephew",
      "description": "Primary caregiver who helps with medications, appointments and daily planning."
    }
  ],
  "communication_preferences": {
    "preferred_language": "Turkish",
    "tone": "Respectful, calm and simple",
    "answer_length": "short",
    "avoid": [
      "medical dosage decisions",
      "technical medical explanations",
      "long instructions",
      "uncertain personal claims"
    ]
  },
  "sample_questions": [
    {
      "question": "Sabah ilacımı aldım mı?",
      "expected_answer_type": "medication_reminder",
      "expected_context_keywords": ["morning medication", "09:00", "breakfast"]
    },
    {
      "question": "Eşim nerede?",
      "expected_answer_type": "family_recall",
      "expected_context_keywords": ["Ayla", "wife", "home"]
    },
    {
      "question": "Ben ne iş yapıyordum?",
      "expected_answer_type": "memory_recall",
      "expected_context_keywords": ["pharmacist", "pharmacy", "Bakırköy"]
    },
    {
      "question": "Tansiyonumu ne zaman ölçüyorum?",
      "expected_answer_type": "routine_reminder",
      "expected_context_keywords": ["blood pressure", "08:00", "morning"]
    },
    {
      "question": "Ben hastaneye mi gideceğim?",
      "expected_answer_type": "safety_fallback",
      "expected_context_keywords": []
    }
  ],
  "safety_notes": {
    "medical_advice_policy": "The assistant must not change medication doses or provide treatment decisions.",
    "hallucination_policy": "The assistant must not invent appointments, hospital visits or medical events that are not present in the persona context.",
    "emergency_policy": "If the user reports severe symptoms, falling, chest pain or urgent distress, the assistant should recommend contacting the caregiver or emergency services."
  }
}