{
  "patient_id": "P-1005",
  "metadata": {
    "full_name": "Hasan Karaca",
    "age": 81,
    "gender": "male",
    "diagnosis": "Moderate Stage Dementia",
    "disease_stage": "moderate",
    "former_profession": "Retired Fisherman",
    "living_status": "Lives with his daughter and receives daily caregiver support",
    "primary_caregiver": "Derya Karaca"
  },
  "orientation_support": {
    "current_home": "Sarıyer, Istanbul",
    "safe_place_reminder": "You are at home with your family and you are safe.",
    "reassurance_message": "Hasan Bey, evdesiniz ve güvendesiniz. Kızınız Derya sizinle ilgileniyor.",
    "emergency_contact_name": "Derya Karaca",
    "emergency_contact_relation": "Daughter"
  },
  "daily_routines": [
    {
      "time": "08:00",
      "activity": "Breakfast",
      "description": "Has breakfast with his daughter Derya.",
      "reminder_type": "meal"
    },
    {
      "time": "08:45",
      "activity": "Morning medication",
      "description": "Takes morning medication after breakfast.",
      "reminder_type": "medication"
    },
    {
      "time": "10:30",
      "activity": "Sea view walk",
      "description": "Takes a short supervised walk near the seaside when the weather is suitable.",
      "reminder_type": "activity"
    },
    {
      "time": "13:00",
      "activity": "Lunch",
      "description": "Has lunch at home.",
      "reminder_type": "meal"
    },
    {
      "time": "16:30",
      "activity": "Photo memory activity",
      "description": "Looks at old family and seaside photos with his caregiver.",
      "reminder_type": "activity"
    },
    {
      "time": "21:00",
      "activity": "Evening medication",
      "description": "Takes evening medication before sleep.",
      "reminder_type": "medication"
    }
  ],
  "medications": [
    {
      "name": "Morning medication",
      "time": "08:45",
      "dose": "1 tablet",
      "note": "Taken after breakfast with caregiver support."
    },
    {
      "name": "Evening medication",
      "time": "21:00",
      "dose": "1 tablet",
      "note": "Taken before sleep."
    }
  ],
  "core_memories": [
    {
      "memory_id": "M-1005-FAMILY-01",
      "category": "family",
      "content": "His daughter is named Derya. She lives with him and supports him during daily routines.",
      "keywords": ["daughter", "Derya", "family", "caregiver"],
      "emotional_tone": "calming"
    },
    {
      "memory_id": "M-1005-FAMILY-02",
      "category": "family",
      "content": "His late wife was named Emine. Talking about Emine should be done gently and only when relevant.",
      "keywords": ["wife", "Emine", "family", "memory"],
      "emotional_tone": "calming"
    },
    {
      "memory_id": "M-1005-WORK-01",
      "category": "work",
      "content": "He worked as a fisherman for many years and often talks about fishing boats and the sea.",
      "keywords": ["fisherman", "boats", "sea", "work"],
      "emotional_tone": "positive"
    },
    {
      "memory_id": "M-1005-HOBBY-01",
      "category": "hobby",
      "content": "He enjoys looking at the sea and listening to old Turkish folk songs.",
      "keywords": ["sea", "folk songs", "music", "hobby"],
      "emotional_tone": "positive"
    },
    {
      "memory_id": "M-1005-PLACE-01",
      "category": "place",
      "content": "He lives in Sarıyer, Istanbul, close to the seaside.",
      "keywords": ["home", "Sarıyer", "Istanbul", "seaside"],
      "emotional_tone": "calming"
    },
    {
      "memory_id": "M-1005-VISUAL-01",
      "category": "visual_memory",
      "content": "Photos of fishing boats, the seaside and old family gatherings help him remember positive moments.",
      "keywords": ["fishing boats", "seaside", "family photos", "visual memory"],
      "emotional_tone": "positive"
    }
  ],
  "family_members": [
    {
      "name": "Derya Karaca",
      "relation": "Daughter",
      "description": "Primary caregiver who lives with him and helps with daily routines."
    },
    {
      "name": "Emine Karaca",
      "relation": "Late wife",
      "description": "His late wife. This memory should be handled gently and respectfully."
    }
  ],
  "communication_preferences": {
    "preferred_language": "Turkish",
    "tone": "Calm, respectful and emotionally gentle",
    "answer_length": "short",
    "avoid": [
      "sudden mention of loss",
      "long explanations",
      "medical advice",
      "arguing with the patient",
      "inventing family events"
    ]
  },
  "sample_questions": [
    {
      "question": "Kızımın adı neydi?",
      "expected_answer_type": "family_recall",
      "expected_context_keywords": ["Derya", "daughter"]
    },
    {
      "question": "Ben nerede yaşıyorum?",
      "expected_answer_type": "orientation",
      "expected_context_keywords": ["Sarıyer", "home", "Istanbul"]
    },
    {
      "question": "Ben ne iş yapardım?",
      "expected_answer_type": "memory_recall",
      "expected_context_keywords": ["fisherman", "boats", "sea"]
    },
    {
      "question": "Akşam ilacımı ne zaman alacağım?",
      "expected_answer_type": "medication_reminder",
      "expected_context_keywords": ["evening medication", "21:00"]
    },
    {
      "question": "Bu fotoğrafta deniz mi var?",
      "expected_answer_type": "memory_recall",
      "expected_context_keywords": ["sea", "seaside", "fishing boats"]
    },
    {
      "question": "Eşim nerede?",
      "expected_answer_type": "safety_fallback",
      "expected_context_keywords": ["Emine", "late wife", "gentle"]
    }
  ],
  "safety_notes": {
    "medical_advice_policy": "The assistant must not provide diagnosis, treatment changes or medication dosage decisions.",
    "hallucination_policy": "The assistant must not invent family events, appointments or personal memories that are not present in the persona context.",
    "emergency_policy": "If the user feels lost, unsafe or physically unwell, the assistant should recommend contacting the caregiver or emergency services."
  }
}